"Status","Start Time","Stop Time","Duration in ms","Parent Suite","Suite","Sub Suite","Test Class","Test Method","Name","Description"
"passed","Tue Apr 30 04:25:17 UTC 2024","Tue Apr 30 04:25:17 UTC 2024","3","","Prova VR","","o rato roeu a roupa","","o rato roeu a roupa","Location - features/backend_tests.feature:32"
"passed","Tue Apr 30 04:25:15 UTC 2024","Tue Apr 30 04:25:16 UTC 2024","1090","","Prova VR","","consultas no portal VR","","consultas no portal VR","Location - features/backend_tests.feature:7"
"passed","Tue Apr 30 04:25:17 UTC 2024","Tue Apr 30 04:25:17 UTC 2024","2","","Prova VR","","bananas e tomates","","bananas e tomates","Location - features/backend_tests.feature:24"
"passed","Tue Apr 30 04:25:17 UTC 2024","Tue Apr 30 04:25:17 UTC 2024","555","","Prova VR","","teste negativo acesso negado ao end point de comum","","teste negativo acesso negado ao end point de comum","Location - features/backend_tests.feature:19"
"passed","Tue Apr 30 04:25:17 UTC 2024","Tue Apr 30 04:25:17 UTC 2024","0","","Prova VR","","the quick brown fox","","the quick brown fox","Location - features/backend_tests.feature:40"
"passed","Tue Apr 30 04:25:16 UTC 2024","Tue Apr 30 04:25:17 UTC 2024","926","","Prova VR","","consulta o primeiro estabelecimento no portal VR","","consulta o primeiro estabelecimento no portal VR","Location - features/backend_tests.feature:13"
