"Status","Start Time","Stop Time","Duration in ms","Parent Suite","Suite","Sub Suite","Test Class","Test Method","Name","Description"
"passed","Tue Apr 30 12:50:33 UTC 2024","Tue Apr 30 12:50:34 UTC 2024","1130","","Prova VR","","consultas no portal VR","","consultas no portal VR","Location - features/backend_tests.feature:8"
"passed","Tue Apr 30 12:50:36 UTC 2024","Tue Apr 30 12:50:36 UTC 2024","3","","Prova VR","","bananas e tomates","","bananas e tomates","Location - features/backend_tests.feature:25"
"passed","Tue Apr 30 12:50:36 UTC 2024","Tue Apr 30 12:50:36 UTC 2024","1","","Prova VR","","o rato roeu a roupa","","o rato roeu a roupa","Location - features/backend_tests.feature:33"
"passed","Tue Apr 30 12:50:36 UTC 2024","Tue Apr 30 12:50:36 UTC 2024","0","","Prova VR","","the quick brown fox","","the quick brown fox","Location - features/backend_tests.feature:41"
"passed","Tue Apr 30 12:50:34 UTC 2024","Tue Apr 30 12:50:35 UTC 2024","956","","Prova VR","","consulta o primeiro estabelecimento no portal VR","","consulta o primeiro estabelecimento no portal VR","Location - features/backend_tests.feature:14"
"passed","Tue Apr 30 12:50:35 UTC 2024","Tue Apr 30 12:50:36 UTC 2024","559","","Prova VR","","teste negativo acesso negado ao end point de comum","","teste negativo acesso negado ao end point de comum","Location - features/backend_tests.feature:20"
